{
  "$schema": "https://json-schema.org/draft/2020-12/schema",
  "$id": "https://band8.local/protocol/0.1/artifact-metadata.schema.json",
  "title": "Band8 Artifact Metadata 0.1",
  "type": "object", "additionalProperties": false,
  "required": ["schema_version", "protocol_version", "artifact_id", "artifact_type", "created_at", "source_activity_id", "content_hash", "relative_path"],
  "properties": {
    "schema_version": {"const": "0.1.0"}, "protocol_version": {"const": "0.1.0"},
    "artifact_id": {"$ref": "#/$defs/id"},
    "artifact_type": {"enum": ["essay", "rewrite", "speaking_audio", "transcript", "highlighted_evidence", "long_form_answer"]},
    "created_at": {"type": "string", "format": "date-time"}, "source_activity_id": {"$ref": "#/$defs/id"},
    "content_hash": {"type": "string", "pattern": "^sha256:[0-9a-f]{64}$"},
    "relative_path": {"type": "string", "minLength": 1, "maxLength": 512}
  },
  "$defs": {"id": {"type": "string", "pattern": "^[A-Za-z0-9][A-Za-z0-9._:-]{2,127}$"}}
}
