{"schema_version":"0.1.0","protocol_version":"0.1.0","artifact_id":"artifact-highlight-001","artifact_type":"highlighted_evidence","created_at":"2026-08-26T04:01:21Z","source_activity_id":"act-evidence","content_hash":"sha256:aaaaaaaaaaaaaaaaaaaaaaaaaaaaaaaaaaaaaaaaaaaaaaaaaaaaaaaaaaaaaaaa","relative_path":"sessions/session-reading-001/artifacts/artifact-highlight-001.json"}
